Date,Title
2011-04-29 07:00:00+00:00,How Asia copes with American zombie consumers - Al Jazeera English
2011-10-15 07:00:00+00:00,"Commodity prices may have plunged, but they could still be the place to invest - The Guardian"
2010-06-16 14:35:42+00:00,"Finance & Development, June 2010 - Oil Subsidies: Costly and Rising - International Monetary Fund"
2010-09-10 02:54:49+00:00,"Finance & Development, September 2010 - How Grim a Fiscal Future? - International Monetary Fund"
2011-11-07 08:00:00+00:00,What Moves the Interest Rate Term Structure? - San Francisco Fed - Federal Reserve Bank of San Francisco
2011-06-10 07:51:10+00:00,"Finance & Development, June 2011 - Emerging Challenges - International Monetary Fund"
2011-03-08 08:00:00+00:00,"Cotton price surge pumps up cost of making U.S. dollar bills - Mar. 8, 2011 - CNN"
2010-04-20 07:00:00+00:00,Is Italy the Next Greece? - Carnegie Endowment for International Peace
2011-09-14 07:00:00+00:00,"Market Report - Sep. 14, 2011 - CNNMoney - CNN"
2011-06-03 07:00:00+00:00,TSX little changed amid disappointing U.S. job growth data - CP24
2011-02-13 08:00:00+00:00,"China booms, Japan stalls - The Globe and Mail"
2011-12-01 18:28:21+00:00,"Finance & Development, December 2011 - Less Volatile than Meets the Eye - International Monetary Fund"
2011-11-17 08:00:00+00:00,"Markets Tumble as Deflation Rises - iShares Silver Trust (ARCA:SLV), SPDR Gold Trust (ARCA:GLD) - Benzinga"
2011-07-13 07:00:00+00:00,Moody's Puts U.S. AAA Credit Rating On Review For Possible Downgrade - Business Insider
2010-04-28 07:00:00+00:00,Europe's financial crisis: as it happened | Financial crisis - The Guardian
2010-12-23 08:00:00+00:00,Mortgage Rates May Have Hit Bottom - The New York Times
2011-02-07 08:00:00+00:00,"Public Lecture on Global and Regional Economic Prospects by Naoyuki Shinohara, IMF's Deputy Managing Director - International Monetary Fund"
2011-08-17 07:00:00+00:00,"Merkel, Sarkozy announce plan after emergency talks - Cape Cod Times"
2010-07-27 07:00:00+00:00,Oil falls towards $78 a barrel after weak US data - Arabian Business
2010-03-12 08:00:00+00:00,Domino’s Pizza is back in Cyprus - Financial Mirror
2010-06-30 07:00:00+00:00,Q+A - How Europe will stress-test its banks - Reuters
2010-10-21 07:00:00+00:00,Federal Reserve reveals state of economy - WWBT
2011-01-04 08:00:00+00:00,"Stock market predictions for 2011 - Jan. 4, 2011 - CNN"
2010-11-14 08:00:00+00:00,Gas Prices Starting To Increase Pre-Thanksgiving - CBS News
2010-04-22 07:00:00+00:00,"Netflix soars, but is it time to sell? - Apr. 22, 2010 - CNN"
2011-07-18 07:00:00+00:00,Gold price hits record amid eurozone and US debt ceiling jitters - The Guardian
2010-02-10 08:00:00+00:00,Greek Unions Strike Amid Debt Crisis - CBS News
2010-07-12 07:00:00+00:00,Upper-Income Americans See Living Standards Improving - news.gallup.com
2011-02-16 08:00:00+00:00,"Protest Wave Grows: Bahrain, Yemen And Now Libya - CBS News"
2010-03-17 07:00:00+00:00,Goldman Sachs and Nostradamus versus Simple Quantitative Models and Common Sense - Bank of America (NYSE: - Benzinga
2011-11-18 08:00:00+00:00,Italy: PM Mario Monti wins second confidence vote - BBC.com
2011-12-06 08:00:00+00:00,Q&A: Eurozone debt crisis - Al Jazeera English
2010-08-20 07:00:00+00:00,Twenty Years of Economic Growth | Speeches | RBA - Reserve Bank of Australia
2010-08-23 07:00:00+00:00,"Cliff Corcoran: Feliz, Garcia strengthen grip on lead in Rookie of the Year chase - Sports Illustrated"
2010-03-23 07:00:00+00:00,Obama Signs Health Care Overhaul Into Law - The New York Times
2010-08-24 07:00:00+00:00,"CNNMoney.com Market Report - Aug. 24, 2010 - CNN"
2010-01-30 08:00:00+00:00,Consumers go sour on the market's sugar rush - The Guardian
2011-03-04 08:00:00+00:00,Average wholesale electric power prices rose in 2010 - U.S. Energy Information Administration - EIA
2010-11-30 08:00:00+00:00,Regional equity markets - Executive Magazine
2011-06-15 07:00:00+00:00,Wall St. Stumbles on Economic Data - The New York Times
2011-01-14 08:00:00+00:00,AIG to Fully Repay U.S. Government - CBS News
2011-10-30 07:00:00+00:00,Japan intervenes in currency market to weaken yen - SKNVibes.com
2011-03-09 08:00:00+00:00,Canadian dollar closes at highest level since late 2007 - CP24
2011-07-20 07:00:00+00:00,Caterpillar Faces Challenge in China - WSJ
2010-05-25 07:00:00+00:00,U.S. Energy Information Administration - EIA
2011-12-21 08:00:00+00:00,$335 Million Settlement on Countrywide Lending Bias - The New York Times
2010-07-30 07:00:00+00:00,"U.S. growth slows to 2.4% rate in second quarter - Jul. 30, 2010 - CNN"
2011-07-08 07:00:00+00:00,ETF Deathwatch for July 2011: The Count Increases to 155 - iShares Trust iShares MSCI Ireland ETF (ARCA:E - Benzinga
2011-09-15 07:00:00+00:00,"Market Report - Sep. 15, 2011 - CNNMoney - CNN"
2010-08-06 07:00:00+00:00,HP CEO Mark Hurd Resigns Unexpectedly Amid Scandal (UPDATED) - WIRED
2010-06-24 07:00:00+00:00,Natural Gas Weekly Update - EIA
2011-02-25 08:00:00+00:00,Does Cold Weather Disprove Climate Change? - Union of Concerned Scientists
2010-07-08 07:00:00+00:00,Investors risk appetite returns 7/8/10 - Benzinga
2011-11-01 07:00:00+00:00,UBS Appoints Anthony Zammar to Head Saudi Arabia Desk in Geneva - Bloomberg
2011-05-03 07:00:00+00:00,"Market Report - May. 3, 2011 - CNNMoney.com - CNN"
2010-06-03 07:00:00+00:00,"Northwest Arkansans Optimistic About Economy, Housing Market | University of Arkansas - University of Arkansas Newswire"
2010-05-19 07:00:00+00:00,Home construction up in April | Arkansas Democrat Gazette - Arkansas Online
2010-11-08 08:00:00+00:00,Is Structural Unemployment on the Rise? - San Francisco Fed - Federal Reserve Bank of San Francisco
2010-11-20 08:00:00+00:00,The Japanese economy’s recovery - East Asia Forum
2010-04-06 07:00:00+00:00,U.S. Birth Rate Decline Linked to Recession - Pew Research Center
2010-08-02 07:00:00+00:00,Rising pork bellies prices hit all-time high - The Guardian
2010-03-26 07:00:00+00:00,Euro rebounds from 10-month dollar low - The Guardian
2010-10-15 07:00:00+00:00,Australian dollar achieves parity with US dollar - The Guardian
2011-01-26 08:00:00+00:00,FRB: Summary of Economic Projections - Federal Reserve
2010-04-14 07:00:00+00:00,Dear Viking Global Investors - Dealbreaker
2011-03-05 08:00:00+00:00,Are buybacks an efficient way to reduce sovereign debt? - cepr.org
2010-05-20 07:00:00+00:00,"CNNMoney.com Market Report - May. 20, 2010 - CNN"
2011-04-09 07:00:00+00:00,Oil and Gas Stocks Bolster Returns for Three Funds - The New York Times
2011-05-01 07:00:00+00:00,Hoarding Nickels as Metal Prices Soar - Newsweek
2011-05-23 07:00:00+00:00,KLM cancels flights due to Iceland ash cloud - Cape Cod Times
2010-04-16 07:00:00+00:00,Ash cloud costing airlines £130m a day - The Guardian
2010-04-19 07:00:00+00:00,Parsing an SEC Party Line Vote on Goldman - CBS News
2010-04-25 07:00:00+00:00,Goldman executives' e-mails show glee at housing's drop - Sarasota Herald-Tribune
2011-05-25 07:00:00+00:00,Indian rupee hits near 3-month low - Markets - Business Recorder
2011-07-12 07:00:00+00:00,"Obama, Lawmakers Hold Round Four of Debt Talks - Voice of America - VOA News"
2011-01-18 08:00:00+00:00,Earnings Optimism 01-14-2011 - Bank Bradesco (NYSE:BBD) - Benzinga
2011-04-27 07:00:00+00:00,"With the soaring commodity prices, are you worried about higher headline inflation? - San Francisco Fed - Federal Reserve Bank of San Francisco"
2011-03-27 07:00:00+00:00,How Nokia fell from dominance and got pinned down by competitors - The Economic Times
2011-09-11 07:00:00+00:00,What caused the recession of 1937-38? - cepr.org
2010-04-26 07:00:00+00:00,Markets tremble as Angela Merkel plays for time over Greece rescue deal - The Guardian
2010-04-08 07:00:00+00:00,Euro Bonds Spreads: Greece at Record - Calculated Risk
2010-04-29 07:00:00+00:00,Malta's lending to Greece will not affect targets - Fenech - Times of Malta
2011-11-21 08:00:00+00:00,‘Super committee’ fails to reach agreement - CNN
2011-09-12 07:00:00+00:00,It's Time to Admit the Euro Has Failed | TIME.com - business.time.com
2010-01-27 08:00:00+00:00,"Apple iPad sends stock down 4% - and then up 1% - Jan. 27, 2010 - CNN"
2011-08-22 07:00:00+00:00,"Gold prices hit record, looking like a bubble - Aug. 22, 2011 - CNN"
2010-07-21 07:00:00+00:00,"Stock market crashes on Black Tuesday | October 29, 1929 | HISTORY - History"
2010-06-07 07:00:00+00:00,"Jefferies: Weak Euro to Hurt Tech Revenues; Fundamentals Remain Strong (GOOG, AMZN, EBAY, YHOO, VPRT) - e - Benzinga"
2010-10-08 07:00:00+00:00,"CNNMoney.com Market Report - Oct. 8, 2010 - CNN"
2011-10-08 07:00:00+00:00,Here we go again - The Economist
2011-09-28 07:00:00+00:00,"Amazon’s Tablet, Kindle Fire, Undercuts iPad’s Price - The New York Times"
2011-10-06 07:00:00+00:00,"Taboos, Italy, and the Euro - Carnegie Endowment for International Peace"
2010-03-31 07:00:00+00:00,"Craig Peckham: Job Growth Returns, Positive Earnings Surprises Ahead - Seeking Alpha"
2010-12-30 08:00:00+00:00,"Silver outshines gold, Sensex in 2010 - The Economic Times"
2011-10-23 07:00:00+00:00,Crisis has potential to split the EU apart - Jamaica Gleaner
2010-06-06 07:00:00+00:00,David Cameron: cuts 'will change British life' - The Guardian
2010-03-02 08:00:00+00:00,"Daimler, BYD in China electric car partnership - China Daily"
2011-04-14 07:00:00+00:00,How Long Will the Dollar Be King? - Carnegie Endowment for International Peace
2011-10-17 07:00:00+00:00,Why has the Kenyan Shilling declined so sharply? - blogs.worldbank.org
2011-11-05 07:00:00+00:00,Europe’s Two Years of Denials Trapped Greece - The New York Times
2010-03-30 07:00:00+00:00,Gold's Low Correlation To Other Asset Classes - Forbes
2011-11-20 08:11:39+00:00,Goldman Sachs - Goldman Sachs
2011-07-19 07:00:00+00:00,"Gold prices breaks £1,000 or $1610 an ounce amid eurozone debt fears - This is Money"
2010-05-21 07:00:00+00:00,Pessimists regaining ground on Europe crisis - 코리아타임스
2011-02-10 08:00:00+00:00,Rising Bond Yield Sounds Alarm For Portugal - CBS News
2010-01-26 08:00:00+00:00,Retail Sales Expected to Show Modest Gain - CBS News
2010-05-04 07:00:00+00:00,Response to Greek crisis - DW (English)
2010-05-29 07:00:00+00:00,Gulf Oil Spill Worst in U.S. Maritime History; Drilling Postponed - National Geographic
2010-11-06 07:00:00+00:00,"Bad WaMu mortgages haunt JPMorgan Chase, Dimon - The Seattle Times"
2011-06-08 07:00:00+00:00,"OPEC oil production increase cannot be agreed upon - Jun. 8, 2011 - CNN"
2011-11-03 07:00:00+00:00,Iran attack 'drawn up by UK and US' as Middle East tensions rise - Daily Mail
2010-04-02 07:00:00+00:00,Israeli air raids wound children - Al Jazeera English
2011-06-09 07:00:00+00:00,Japan disaster narrows US trade gap - RTE.ie
2010-12-03 08:00:00+00:00,"November jobs report:Unemployment rate rises to 9.8% - Dec. 3, 2010 - CNN"
2010-09-14 07:00:00+00:00,Young Greeks Seek Options Elsewhere - The New York Times
2011-07-04 17:29:03+00:00,"Lingering Threats: One Year After Gulf Oil Disaster, Offshore Drilling Still Urgently Needs Reform - Center for Biological Diversity"
2011-09-16 07:00:00+00:00,"Market Report - Sep. 16, 2011 - CNNMoney - CNN"
2010-04-01 07:00:00+00:00,New Jobless Claims Fall Slightly to 439K - CBS News
2010-09-28 07:00:00+00:00,Advanced economies risk slipping into Japan-style 'lost decade' - Risk.net
2011-04-21 07:00:00+00:00,"Market Report - Apr. 21, 2011 - CNNMoney.com - CNN"
2011-06-27 07:00:00+00:00,Core Inflation Rises--Interest Rates May Follow | The Fiscal Times - The Fiscal Times
2010-08-13 07:00:00+00:00,"New Orleans Residents Say Recovery Is Making Progress, But Many Believe The Gulf Oil Spill Will Be More Damaging ... - KFF"
2011-06-01 07:00:00+00:00,"Market Report - Jun. 1, 2011 - CNNMoney - CNN"
2010-09-05 07:00:00+00:00,America's economic conundrum | Commentary - Jamaica Gleaner
2010-10-26 07:00:00+00:00,"CNNMoney.com Pre-Market Report - Oct. 26, 2010 - CNN"
2010-06-28 07:00:00+00:00,Oil Spill's Economic Impact Mostly Local - CBS News
2011-05-08 07:00:00+00:00,13% of households fail to pay interest - 코리아타임스
2010-05-18 07:00:00+00:00,Euro in trouble - DW (English)
2010-06-18 07:00:00+00:00,Strong week for euro - RTE.ie
2010-06-22 07:00:00+00:00,Emergency budget: George Osborne's speech in full - The Guardian
2010-05-01 07:00:00+00:00,The Financial Power Elite - Monthly Review
2010-01-14 08:00:00+00:00,Top 15 Global Bank Stocks Ranked by Price-to-Book Value - Seeking Alpha
2011-02-15 08:00:00+00:00,Alan Greenspan: feted for failure - The Guardian
2010-07-05 07:00:00+00:00,The Unacknowledged Success of Neoliberalism - Econlib
2010-01-19 08:00:00+00:00,Inflation: Mind the Gap - San Francisco Fed - Federal Reserve Bank of San Francisco
2011-09-24 07:00:00+00:00,"Lagarde, New I.M.F. Chief, Rocks the Boat - The New York Times"
2010-03-06 08:00:00+00:00,"Gold gets support from strong markets, Chile earthquake to end week at $1,134 - Proactive Investors UK"
2011-04-08 07:00:00+00:00,What's Moving Silver's Price to $40? - TheStreet
2011-10-28 07:00:00+00:00,"Whirlpool to Cut 5,000 Jobs - Whirlpool (NYSE:WHR) - Benzinga"
2011-12-01 18:28:05+00:00,"Finance & Development, December 2011 - A Cushion for the Poor - International Monetary Fund"
2010-09-18 07:00:00+00:00,Deaths as Karl hits Mexico - Al Jazeera English
2011-01-10 08:00:00+00:00,Alaska Pipeline's Closure Threatens to Raise Oil Prices - The Wall Street Journal
2011-03-19 07:00:00+00:00,Libya: Gaddafi forces attacking rebel-held Benghazi - BBC.com
2010-07-26 07:00:00+00:00,Consumer confidence shows a slowing down in pace of recovery for the first half of 2010 - OECD
2011-04-04 07:00:00+00:00,TI to acquire National Semiconductor - PR Newswire
2010-09-20 07:00:00+00:00,"NBER declares recession ended in June 2009 - Sep. 20, 2010 - CNN"
2010-12-17 08:00:00+00:00,Currency Wars and China - Financial Sense Online
2011-07-24 07:00:00+00:00,"Stocks: Debt ceiling, earnings in focus - Jul. 24, 2011 - CNN"
2011-05-04 07:00:00+00:00,"Weborama Discusses First Quarter Results, Southern European Strategy, And The Potential Of The New Data Offering ... - ExchangeWire"
2010-09-03 07:00:00+00:00,"CNNMoney.com Market Report - Sep. 3, 2010 - CNN"
2011-05-18 07:00:00+00:00,Japanese Disaster Affects Tourism in Hawaii; Moody's Cuts State's Credit Rating - ABC News
2011-01-19 08:00:00+00:00,"Stocks on the move: Motorola Mobility, Pernix, Shen Zhou, Tessco - The Mercury News"
2011-08-26 07:00:00+00:00,"Gas prices may spike on Hurricane Irene if oil refiners shut - Aug. 26, 2011 - CNN"
2011-11-25 08:00:00+00:00,The Failure to Forecast the Great Recession - Liberty Street Economics - Liberty Street Economics -
2010-12-07 08:00:00+00:00,Slower Growth For East Asia - Radio Free Asia
2011-10-10 07:00:00+00:00,5 CEOs who think like Steve Jobs did - MarketWatch
2010-08-27 07:00:00+00:00,"GDP report: Economic growth for second quarter slows to 1.6% - Aug. 27, 2010 - CNN"
2011-08-24 07:00:00+00:00,Did the stimulus work? A review of the nine best studies on the subject - The Washington Post
2010-08-15 07:00:00+00:00,China Passes Japan to Become No. 2 Economy - The New York Times
2010-05-17 07:00:00+00:00,Empire State Manufacturing Survey - FEDERAL RESERVE BANK of NEW YORK - Federal Reserve Bank of New York
2010-09-22 07:00:00+00:00,"Amid Tension, China Blocks Vital Exports to Japan (Published 2010) - The New York Times"
2010-11-03 07:00:00+00:00,BHP's bid for Potash Corporation blocked by Canadian government - The Guardian
2010-11-11 08:00:00+00:00,Disappointing Cisco Outlook Sinks Stocks - CBS News
2010-08-19 07:00:00+00:00,Intel Buys McAfee for More Than $7.6 Billion - The New York Times
2010-08-29 07:00:00+00:00,Behind The Bidding War: The Real Reasons Why HP And Dell are So Desperate For 3Par - TechCrunch
2010-11-02 07:00:00+00:00,Australia and India in interest rate rises - BBC.com
2010-08-26 07:00:00+00:00,"CNNMoney.com Market Report - Aug. 26, 2010 - CNN"
2011-03-02 08:00:00+00:00,Fed survey: Economy expands throughout U.S. - CBS News
2010-11-21 08:00:00+00:00,What Good Is Wall Street? - The New Yorker
2010-05-03 07:00:00+00:00,ECB agrees to accept Greek 'junk' bonds as collateral - POLITICO Europe
2011-06-24 07:00:00+00:00,Number of Chinese millionaires rises by 12% - china.org.cn
2011-02-01 08:00:00+00:00,When Will Russia Resume Grain Exports Again? - The Wall Street Journal
2011-08-31 07:00:00+00:00,ExxonMobil Gains Access to Arctic Oil and Gas Reserves in Deal with Rosneft - The Arctic Institute
2010-10-01 07:00:00+00:00,World Beaters - Global Finance
2010-09-29 07:00:00+00:00,China in Transition「China Beginning to Show Signs of Cooling Inflation: Receding fears of rate hike」 - rieti.go.jp
2010-02-16 08:00:00+00:00,Japan economic growth exceeds expectations - Mmegi Online
2010-05-26 07:00:00+00:00,"Today in Commodities: Are We Standard, Or Poor? - Seeking Alpha"
2010-12-08 08:00:00+00:00,Russia's pocket banks face tougher future - The Banker
2010-06-09 07:00:00+00:00,Expected Record IPO in China Boosts Stocks - CBS News
2011-11-11 08:00:00+00:00,"G20 leaders agree to boost IMF, but not how - CBS News"
2011-12-16 08:00:00+00:00,Fitch gloomy on summit deal outcome - RTE.ie
2011-12-22 08:00:00+00:00,Bohai Bay Field - Offshore Technology
2010-11-19 08:00:00+00:00,"Goldman Sachs shares are surging again - The Buzz - Nov. 19, 2010 - CNN"
2011-06-10 07:51:06+00:00,"What Are Economic Models? - Back to Basics: Finance & Development, June 2011 - International Monetary Fund"
2011-02-28 08:00:00+00:00,How Boeing Won The Tanker War - Forbes
2011-01-22 08:00:00+00:00,Asian stocks slide as policy worries intensify Aaj English TV - Aaj News
2011-11-02 07:00:00+00:00,EU leaders scramble to defuse Greek debt 'bomb' - FRANCE 24 English
2011-10-24 07:00:00+00:00,World stocks climb as investors upbeat after EU summit - SKNVibes.com
2010-02-09 08:00:00+00:00,"Gold prices soar | January 14, 1980 | HISTORY - History"
2011-07-04 17:31:53+00:00,A Deadly Toll - Center for Biological Diversity
2011-03-29 07:00:00+00:00,Cut Spending – But Not My Farm Subsidies! - Environmental Working Group
2011-02-11 08:00:00+00:00,Nokia and Microsoft join forces - Al Jazeera English
2011-05-22 07:00:00+00:00,"As Banks Hold Foreclosed Homes, a Kink in the Housing Market - The New York Times"
2010-09-07 07:00:00+00:00,Revisiting the Debate over the Yen's Appreciation - rieti.go.jp
2011-02-12 08:00:00+00:00,Cotton Prices Hit All-Time High - WSJ - The Wall Street Journal
2011-02-08 08:00:00+00:00,Wealth management seen vaulting UBS back into the black - InvestmentNews
2011-02-23 08:00:00+00:00,Airlines Are Raising Fares as Oil Prices Rise - The New York Times
2011-10-18 07:00:00+00:00,"Goldman Sachs reports first loss since 2008 - Oct. 18, 2011 - CNN"
2010-01-10 08:00:00+00:00,Fundamental Opportunities in Emerging Markets - Seeking Alpha
2011-12-01 18:28:41+00:00,"Finance & Development, December 2011 - Fixing the Flaws in EMU - International Monetary Fund"
2011-09-10 07:00:00+00:00,Democrats Fret Aloud Over Obama’s Chances - The New York Times
2011-10-05 07:00:00+00:00,"Market Report - Oct. 5, 2011 - CNNMoney - CNN"
2011-11-08 08:00:00+00:00,"China's Housing Bubble Past, And Its Future - Forbes"
2011-06-19 07:00:00+00:00,Three Gorges ship lock marks 8 years of operation - china.org.cn
2011-11-26 08:00:00+00:00,"Black Friday sales hit record: report - Nov. 26, 2011 - CNN"
2011-06-18 07:00:00+00:00,Three Gorges ship lock marks 8 years of operation - China Daily
2011-11-04 07:00:00+00:00,G-20 Cannes Summit Final Communiqué [FULL TEXT] - International Business Times
2010-11-22 08:00:00+00:00,"Stocks on the move: Bank of Ireland, Citi Trends, Dundee, Novell - The Mercury News"
2010-04-18 07:00:00+00:00,Section 1: Trust in Government 1958-2010 - Pew Research Center
2011-03-24 07:00:00+00:00,A Tale of Two Polities: UK and U.S. Fiscal Policy - Carnegie Endowment for International Peace
2011-06-22 07:00:00+00:00,Oil Speculators: Civil Complaint Names Nicholas Wildgoose of Fairbanks Ranch - San Diego Reader
2010-11-28 08:00:00+00:00,Irish Republic 85bn euro bail-out agreed - BBC.com
2010-03-29 07:00:00+00:00,"FTSE 100 inches lower as Whitbread, BSkyB, BUrberry, Interte and Autonomy Corp weigh - Proactive Investors UK"
2011-10-20 07:00:00+00:00,Blackstone Posts Loss as Deals Dry Up - TheStreet
2010-11-25 08:00:00+00:00,Mervyn King's support for cuts 'excessively political' – MPC member - The Guardian
2011-07-30 07:00:00+00:00,How much closer a union? - The Economist
2010-12-19 08:00:00+00:00,Snow ruins thousands of Christmas holidays as Heathrow Airport buckles under weather - Daily Mail
2011-10-25 07:00:00+00:00,Why are unionised countries often successful in attracting foreign direct investment? - CEPR
2011-01-21 08:00:00+00:00,"General Electric logs 31% gain in profit - Jan. 21, 2011 - CNN"
2011-01-03 08:00:00+00:00,Fed’s $600 Billion 'Hedge Fund' to Fend off New Risks - The Fiscal Times
2010-12-22 08:00:00+00:00,Toronto-Dominion Agrees to Buy Chrysler Financial for $6.3 Billion - The Ledger
2011-11-10 08:00:00+00:00,World Stocks Tumble on Italy's Turmoil - Benzinga
2011-06-28 07:00:00+00:00,"Job Worries Increase, Consumer Confidence Declines - CBS Los Angeles - CBS Los Angeles"
2010-12-28 08:00:00+00:00,China in Transition「Share Price Cycle in China Linked to Business Cycle」 - rieti.go.jp
2011-06-20 07:00:00+00:00,Romanian currency falls 0.6pc; banks exposed to Greece - Business Recorder
2011-02-17 08:00:00+00:00,Natural Gas Weekly Update - EIA
2011-04-22 07:00:00+00:00,Global growth generators: Moving beyond emerging markets and BRICs - CEPR
2010-03-27 07:00:00+00:00,U.S. Corporate Profits Kept Climbing at End of 2009 - The Wall Street Journal
2011-06-28 16:11:07+00:00,"Finance & Development, March 2010 - Dollarization Declines in Latin America - International Monetary Fund"
2011-06-10 07:51:26+00:00,"Finance & Development, June 2011 - The Human Face of Economics - International Monetary Fund"
2011-06-23 07:00:00+00:00,Why doesn't Canada have more top companies? - The Globe and Mail
2011-09-20 07:00:00+00:00,The domino effect in Europe's debt crisis - BBC.com
2011-08-21 07:00:00+00:00,Investors rush to gold as world markets take a hit - 台北時報
2011-06-01 20:29:47+00:00,"Finance & Development, December 2010 - The Tragedy of Unemployment - International Monetary Fund"
2011-09-05 07:00:00+00:00,Fears rise again over Europe debt crisis - Financial Times
2010-02-26 08:00:00+00:00,Mining and metallurgy: The role of filters in mining and quarrying - Filtration + Separation
2011-03-15 07:00:00+00:00,Markets continue dive over nuclear disaster worries - FRANCE 24 English
2011-01-08 08:00:00+00:00,Japanese shares rise 0.11% on easing yen Aaj English TV - Aaj News
2011-06-26 07:00:00+00:00,"Worries, pessimism hurting economy - WBEZ Chicago"
2011-07-14 07:00:00+00:00,On the edge - The Economist
2011-07-07 07:00:00+00:00,ECB raises interest rates despite debt crisis - The Guardian
2011-01-17 08:00:00+00:00,Steve Jobs' medical leave: Apple CEO is keeping the reasons for his absence private. Is that fair to investors? - Slate
2010-07-14 07:00:00+00:00,Fed Eyes Steps To Bolster Sputtering Recovery - CBS News
2010-06-17 07:00:00+00:00,Chapter 3. Economic Issues - Pew Research Center
2011-03-28 07:00:00+00:00,Government shutdown looms as congressional budget talks stall - CBS News
2011-04-15 07:00:00+00:00,China’s inflation continues to rise - Al Jazeera English
2011-02-22 08:00:00+00:00,Oil jumps to above $90 as Libya protests spread - LA Daily News
2011-02-02 08:00:00+00:00,"Ford stock plummets after earnings miss. Is the rally over? - Feb. 2, 2011 - CNN"
2010-12-13 08:00:00+00:00,"Hoenig, Contrarian at the Fed, Keeps Wary Eye on History - The New York Times"
2011-11-30 08:00:00+00:00,US stocks close up over 4% on central banks' move - SKNVibes.com
2010-03-09 08:00:00+00:00,A 4% inflation target? - CEPR
2010-09-16 07:00:00+00:00,"FedEx to combine Freight, National LTL operations - CCJ"
2010-02-18 08:00:00+00:00,Let the Greeks ruin themselves - The Economist
2011-12-14 08:00:00+00:00,Yuri Kozyrev: My Year On Revolution Road - TIME
2011-12-23 08:00:00+00:00,"Christchurch, New Zealand, rocked by series of earthquakes, but no casualties - The Christian Science Monitor"
2011-11-19 08:00:00+00:00,The German problem - The Economist
2010-10-29 07:00:00+00:00,After the Great Recession: Foreign Born Gain Jobs; Native Born Lose Jobs - Pew Research Center
2010-10-16 07:00:00+00:00,One-for-one: dollar hits parity - Sydney Morning Herald
2011-10-12 07:00:00+00:00,Some Fed policymakers want more stimulus: minutes - SKNVibes.com
2011-02-20 08:00:00+00:00,China acts to stamp out call for 'Jasmine Revolution' - CTV News
2011-03-26 07:00:00+00:00,Why (or why not) nuclear energy? - CNN
2011-02-21 08:00:00+00:00,ECB figures suggest Portugal debt buys - RTE.ie
2010-11-13 08:00:00+00:00,Is the Fed's rally already over? - Daily Herald
2011-04-18 07:00:00+00:00,China Raises Banks' Reserve Requirements - WSJ - WSJ
2011-07-11 07:00:00+00:00,Euro slumps on alarm signals from eurozone bond market - SKNVibes.com
2011-04-16 07:00:00+00:00,The problem with Infosys Technologies - The Economic Times
2011-12-17 08:00:00+00:00,A comedy of euros - The Economist
2011-06-10 07:51:13+00:00,"Finance & Development, June 2011 - Shaken to the Core - International Monetary Fund"
2011-12-20 08:00:00+00:00,ETFs for the long haul - iShares Russell 2000 Growth Index ETF (3) - CNNMoney - CNN
2011-06-14 07:00:00+00:00,Timberland Co. sells for $2.2B - Seacoastonline.com
2010-12-27 08:00:00+00:00,Gem of a company does Penang proud - The Edge Malaysia
2011-05-20 07:00:00+00:00,Small- And Mid-Cap Stocks Offer Most Promise In Health Care Sector - CNBC
2011-01-11 08:00:00+00:00,Contract Management - A Fundamental Component of Any Resource Management Program - United States Army
