Date,Title
2011-06-25 07:00:00+00:00,Insiders Sound an Alarm Amid a Natural Gas Rush (Published 2011) - The New York Times
2010-12-12 08:00:00+00:00,The Efficiency Dilemma - The New Yorker
2011-06-21 07:00:00+00:00,Euro climbs versus dollar on Greece optimism - SKNVibes.com
2011-05-30 07:00:00+00:00,Germany: Nuclear power plants to close by 2022 - BBC.com
2010-08-16 07:00:00+00:00,"China marches towards world's No. 2 economy - Aug. 16, 2010 - CNN"
2011-11-12 08:00:00+00:00,A case of the sniffles - The Economist
2011-07-17 07:00:00+00:00,Validus cuts in on Allied World's bid for Transatlantic - Business Insurance
2011-04-13 07:00:00+00:00,"Market Report - Apr. 13, 2011 - CNNMoney.com - CNN"
2011-08-16 07:00:00+00:00,"Eurobond Debate Rises in Germany, France - WSJ"
2010-03-25 07:00:00+00:00,Heading Off the Next Financial Crisis - The New York Times
2011-06-13 07:00:00+00:00,Monetary Policy When One Size Does Not Fit All - San Francisco Fed - Federal Reserve Bank of San Francisco
2010-02-28 08:00:00+00:00,Investors likely to remain cautious as March opens - CTV News
2010-07-22 07:00:00+00:00,The Right Way To Own Gold - Forbes
2010-07-07 07:00:00+00:00,"The Buzz: Google investors aren't feeling lucky anymore - Jul. 7, 2010 - CNN"
2011-07-16 07:00:00+00:00,Eurozone's citizens split amid battle to stop debt crisis spreading - The Guardian
2011-12-01 18:28:57+00:00,"Finance & Development, December 2011 - What Ails South Africa - International Monetary Fund"
2011-08-20 07:00:00+00:00,The bonds that tie—or untie - The Economist
2011-05-15 07:00:00+00:00,Billion-dollar Mother Dairy's new strategies to win back market base and go national - The Economic Times
2010-09-09 07:00:00+00:00,Consumer Spending Across All Income Groups Down in August - news.gallup.com
2010-07-31 07:00:00+00:00,July 2010 - Calculated Risk
2011-08-28 07:00:00+00:00,"After Hurricane Irene, Markets Plan Business as Usual - The New York Times"
2011-01-15 03:13:04+00:00,Research & Ratings: Region - Moody's
2011-09-13 07:00:00+00:00,"World's 50 safest banks league: HSBC, Nationwide and Barclays make it in - This is Money"
2011-04-24 07:00:00+00:00,Is gold rising because America is broke? - International Business Times
2010-08-10 07:00:00+00:00,"Housing starts slip in July, home prices rise modestly in June in cooling trend - CP24"
2010-01-25 08:00:00+00:00,Bankers Return to Davos With a Bit Less Swagger (Published 2010) - The New York Times
2010-09-10 07:00:00+00:00,"CNNMoney.com Market Report - Sep. 10, 2010 - CNN"
2011-10-26 07:00:00+00:00,Financial Institutions Eligible for Stamp Duty Exemptions - China Briefing
2010-03-15 07:00:00+00:00,The Economics of Online News - Pew Research Center
2011-03-04 00:50:51+00:00,"Finance & Development, March 2011 - Veterans of the System - International Monetary Fund"
2010-01-07 08:00:00+00:00,Fear of the dragon - The Economist
2010-01-31 08:00:00+00:00,What really happened at Hypo Group Alpe Adria - The Banker
2010-06-11 07:00:00+00:00,The Flourishing Indian Wedding Industry - Indian Retailer
2011-03-19 21:41:49+00:00,"Finance & Development, December 2010 - Gauging China's Influence - International Monetary Fund"
2011-12-18 08:00:00+00:00,S. Korea Calls for Calm Following Kim Jong Il Death - Voice of America - VOA News
2011-09-13 02:49:51+00:00,"Finance & Development, September 2011 - More Europe, Not Less - International Monetary Fund"
2010-10-09 07:00:00+00:00,A better way - The Economist
2010-04-11 07:00:00+00:00,Euro Nations Offer Greece $40 Billion Backstop - CBS News
2011-12-02 08:00:00+00:00,GMAC Mortgage to halt most new lending in Massachusetts in wake of Attorney General Martha Coakley's suit - MassLive.com
2011-12-08 08:00:00+00:00,"ECB cuts interest rates, signals willingness to help banks - Dec. 8, 2011 - CNN"
2010-01-15 08:00:00+00:00,JPMorgan Chase Earns $11.7 Billion in Year - The New York Times
