Date,Title
2010-02-04 08:00:00+00:00,"CNNMoney.com Market Report - Feb. 4, 2010 - CNN"
2011-08-08 07:00:00+00:00,Debt crisis sends financial markets into turmoil – Monday 8 August 2011 - The Guardian
2011-10-04 07:00:00+00:00,"Market Report - Oct. 4, 2011 - CNNMoney - CNN"
2010-12-02 08:00:00+00:00,Natural Gas Weekly Update - EIA
2011-01-05 08:00:00+00:00,World food prices enter 'danger territory' to reach record high - The Guardian
2011-01-02 08:00:00+00:00,Copper mining sees new AZ momentum - Tucson - Arizona Daily Star
2011-12-15 08:00:00+00:00,Oil slumps after OPEC agrees 30 million barrel per day target - Proactive Investors Australia
2011-11-28 08:00:00+00:00,"Market Report - Nov. 28, 2011 - CNNMoney - CNN"
2010-11-04 07:00:00+00:00,Fed $600 Billion Spree: 7 Questions - CBS News
2010-08-11 07:00:00+00:00,"Dollar hits 15-year low against yen - Aug. 11, 2010 - CNN"
2011-02-26 08:00:00+00:00,"Gas rises as oil prices spike - Feb. 26, 2011 - CNN"
2010-12-14 08:00:00+00:00,Reagan's Recession - Pew Research Center
2011-08-18 07:00:00+00:00,The European Central Bank as a lender of last resort - CEPR
2010-12-10 08:00:00+00:00,5 Failed Currencies And Why They Crashed - Forbes
2010-06-10 07:00:00+00:00,Diesel-fuel prices at 10-week low | Arkansas Democrat Gazette - Arkansas Online
2010-10-14 07:00:00+00:00,Australian Dollar Reaches New High - The Wall Street Journal
2011-05-11 07:00:00+00:00,"Bush Lost Battle Over the Surplus, But Won Tax Cut War - Pew Research Center"
2011-03-11 08:00:00+00:00,Japan's Stock Market Post-Kobe Earthquake in 1995 (NYSEARCA:EWJ) - Seeking Alpha
2010-05-28 07:00:00+00:00,Barton Biggs of Traxis Partners Sees Bounce Back - Seeking Alpha
2010-08-30 07:00:00+00:00,"1970s Energy Crisis - Causes, Effects, OAPEC | HISTORY - History"
2010-01-04 08:00:00+00:00,Wall St. Extends '09 Rally into New Year - CBS News
2010-04-12 07:00:00+00:00,"Dow Closes Above 11,000 - The New York Times"
2004-12-21 08:00:00+00:00,Stock Market Hits 3½-Year High - CBS News
2011-06-10 07:50:55+00:00,"Finance & Development, June 2011 - Esprit de Currency - International Monetary Fund"
2011-12-28 08:00:00+00:00,"2011: Gold, silver touch all-time highs amid economic turmoil and rising inflation - The Economic Times"
2010-10-04 07:00:00+00:00,Swiss Banks Face Higher Than Global Capital Standards - The New York Times
2011-04-20 07:00:00+00:00,Gold and Silver Prices Surging - The New York Times
2010-07-01 07:00:00+00:00,"CNNMoney.com Market Report - Jul. 1, 2010 - CNN"
2011-08-13 07:00:00+00:00,Hit me baby one more time - The Economist
2010-01-17 08:00:00+00:00,Dissecting the Yield Curve and Looking for Inflation - Seeking Alpha
2011-08-04 07:00:00+00:00,Stock markets plunge - Thursday 4 August 2011 | Business | theguardian.com - The Guardian
2010-08-07 07:00:00+00:00,How to Beat Deflation - WSJ - The Wall Street Journal
2011-08-05 07:00:00+00:00,S.& P. Downgrades Debt Rating of U.S. for the First Time (Published 2011) - The New York Times
2010-05-07 07:00:00+00:00,"April Jobs report: Biggest gain since 2006, unemployment up - May. 7, 2010 - CNN"
2011-09-02 07:00:00+00:00,Markets retreat as U.S. job growth flatlines - CP24
2011-07-27 07:00:00+00:00,Silver Price Bubble? - National Association of REALTORS®
2011-04-11 07:00:00+00:00,The Fed's Interest Rate Risk - San Francisco Fed - Federal Reserve Bank of San Francisco
2011-08-09 07:00:00+00:00,Federal Reserve pledges to keep interest rates low for two years - The Guardian
2011-08-23 07:00:00+00:00,Peter G. Peterson Foundation Analysis of the Budget Control Act of 2011 - Peterson Foundation
2011-07-25 07:00:00+00:00,"Stock Market: Gold Rises, Stocks Fall, Treasury to Cut Auction - ABC News"
2011-11-14 08:00:00+00:00,"Eurozone crisis 'toughest hour since World War II', says Merkel - FRANCE 24 English"
2011-08-02 07:00:00+00:00,"Market Report - Aug. 2, 2011 - CNNMoney - CNN"
2011-12-29 08:00:00+00:00,U.S. warns Iran against closing oil passage - The Korea Herald
2011-11-22 08:00:00+00:00,No election relief for Spanish bonds - RTE.ie
2010-04-27 07:00:00+00:00,Naira loses another five kobo at WDAS - Vanguard
2011-05-06 07:00:00+00:00,"Stock Market Report CNNMoney -- May 6, 2011 - May. 6, 2011 - CNN"
2010-11-23 08:00:00+00:00,"Market Report - Nov. 23, 2010 - CNNMoney.com - CNN"
2011-08-01 07:00:00+00:00,Minn.'s Ellison A 'No' On Debt Deal; Franken Yes - CBS Minnesota
2011-05-24 07:00:00+00:00,U.S. stock futures higher ahead of housing data; Dow up 0.2% - Benzinga
2011-06-29 07:00:00+00:00,Athens says 'yes' – now what? - Benzinga
2010-06-23 07:00:00+00:00,FRB: Summary of Economic Projections - Federal Reserve
2011-03-16 07:00:00+00:00,"Dollar hits all-time low against yen - Mar. 16, 2011 - CNN"
2011-06-01 20:27:12+00:00,"Finance & Development, December 2010 - Stimulus Worked - International Monetary Fund"
2010-07-19 07:00:00+00:00,The Case for Emerging Markets - MINING.COM - MINING.com
2010-09-17 07:00:00+00:00,Gold prices – the highs and lows since 1971 - The Guardian
2011-03-07 08:00:00+00:00,"gold, silver prices surge - Mar. 7, 2011 - CNN"
2011-01-12 08:00:00+00:00,The Road to Economic Crisis Is Paved With Euros - The New York Times
2011-05-12 07:00:00+00:00,Investors are Shifting Assets to Cash from Commodities; Should You? - Benzinga
2011-02-24 08:00:00+00:00,Consumers 'A Little More' Confident About Economy - WBEZ Chicago
2011-12-25 08:00:00+00:00,The market in 2011 and your money | Mint - Mint
2011-10-19 07:00:00+00:00,European stocks rally on hopes of rescue fund boost - SKNVibes.com
2010-05-24 07:00:00+00:00,Timeline: History of central bank intervention - Reuters
2011-03-04 00:34:29+00:00,"Finance & Development, March 2011 - Rising Prices on the Menu - International Monetary Fund"
2011-08-06 07:00:00+00:00,Questions abound after agency downgrades U.S. credit rating - CNN International
2010-05-13 07:00:00+00:00,The Rise and Fall of the G.D.P. - The New York Times
2011-01-13 08:00:00+00:00,Time for Plan B - The Economist
2010-05-05 07:00:00+00:00,How does the stock market respond to petrochemical disasters? - CEPR
2011-09-06 07:00:00+00:00,Stock Market Worrying Wall Street Investors - business.time.com
2011-09-19 07:00:00+00:00,"Greek default: What it would mean - Sep. 19, 2011 - CNN"
2011-07-22 07:00:00+00:00,"Dairy Market Update, July 2011 - MSU Extension - Michigan State University"
2011-11-24 08:00:00+00:00,German Nov. Ifo business confidence index rises - MarketWatch
2011-02-14 08:00:00+00:00,Global Economic Recovery Sparks Inflation Fears | The Fiscal Times - The Fiscal Times
2010-01-05 08:00:00+00:00,Warren Buffett weighs into Kraft's battle for Cadbury - The Guardian
2010-01-20 08:00:00+00:00,Import and export prices increase in 2009 : The Economics Daily : U.S - Bureau of Labor Statistics
2010-03-11 08:00:00+00:00,Summary of the 2009 Financial Report of the US - Peterson Foundation
2010-12-01 08:00:00+00:00,"Price Spikes in Global Rice Markets Benefit U.S. Growers, at Least in the Short Term - usda.gov"
2011-01-31 08:00:00+00:00,"GM catches Ford in market value - Jan. 31, 2011 - CNN"
2010-11-09 08:00:00+00:00,Doubts raised over Fed plan - The Augusta Chronicle
2011-03-17 07:00:00+00:00,Grocery prices jump - Amarillo Globe-News
2011-08-19 07:00:00+00:00,"Fed could launch 'Operation Twist' instead of QE3 - The Buzz - Aug. 19, 2011 - CNN"
2010-08-31 07:00:00+00:00,August 2010 - Calculated Risk
2010-11-10 08:00:00+00:00,Gap Joins a Retailer Rush to the Chinese Market - The New York Times
2011-09-01 07:00:00+00:00,The sorry and familiar story of Italy's debt crisis - The Banker
2010-11-16 08:00:00+00:00,"Stocks Plunge on Asian Inflation, Europe Fears - CBS News"
2010-09-21 07:00:00+00:00,"Gold prices rise, but up or down, gold's always around. Unlike stocks. - The Christian Science Monitor"
2011-05-05 07:00:00+00:00,Crude Oil Falls Below $100 a Barrel - The New York Times
2011-12-09 08:00:00+00:00,"Market Report - Dec. 9, 2011 - CNNMoney - CNN"
2011-09-25 07:00:00+00:00,Czech Republic: 'Switzerland of Eastern Europe' - CNBC
2010-12-21 08:00:00+00:00,"Gas prices surge 76% from 2008. Montana hardest hit - Dec. 21, 2010 - CNN"
2011-07-06 07:00:00+00:00,"Two Years of Economic Recovery: Women Lose Jobs, Men Find Them - Pew Research Center"
2010-02-08 08:00:00+00:00,Hong Kong and China and the Global Recession - San Francisco Fed - Federal Reserve Bank of San Francisco
2011-10-07 07:00:00+00:00,The Banker's Investment Banking Awards 2011 - The Banker
2010-04-09 07:00:00+00:00,"Dow Crosses 11,000, and Then Slips Back - The New York Times"
2011-10-11 07:00:00+00:00,Slovakia rejects multibillion euro bailout fund to deal with debt crisis - The Guardian
2010-06-14 07:00:00+00:00,The Fed's Exit Strategy for Monetary Policy - San Francisco Fed - Federal Reserve Bank of San Francisco
2011-02-18 08:00:00+00:00,"Market Report - Feb. 18, 2011 - CNNMoney.com - CNN"
2010-06-16 07:00:00+00:00,Economy : Developing countries set to account for nearly 60% of world GDP by 2030 - OECD
2010-01-11 08:00:00+00:00,How News Happens - Pew Research Center
2011-10-09 07:00:00+00:00,"Stocks: Earnings and Europe come knocking - Oct. 9, 2011 - CNN"
2011-10-13 07:00:00+00:00,Explaining the Drop in the Copper Price | Gold News - BullionVault
2011-01-30 08:00:00+00:00,Musings on the Record Price of Copper - MINING.COM - MINING.com
2011-10-14 07:00:00+00:00,The Bank of England's second round of quantitative easing may do little to improve economic confidence or to ... - British Politics and Policy at LSE
2010-10-18 07:00:00+00:00,"France, Germany and Russia begin Trilateral Summit - Atlantic Council"
2011-05-27 07:00:00+00:00,BlackRock's Rick Rieder takes a stand on bonds - CNN
2010-02-05 08:00:00+00:00,Stocks Tumble Amid Recovery Doubts - 코리아타임스
2010-01-12 08:00:00+00:00,"Google, Citing Cyber Attack, Threatens to Exit China - The New York Times"
2010-01-13 08:00:00+00:00,"Alcoa sales slide, losses shrink | Business - Jamaica Gleaner"
2010-06-15 07:00:00+00:00,"The Buzz: Why China keeps on buying U.S. debt - Jun. 15, 2010 - CNN"
2011-05-10 07:00:00+00:00,Microsoft confirms takeover of Skype - BBC.com
2011-08-10 07:00:00+00:00,"Market Report - Aug. 10, 2011 - CNNMoney - CNN"
2011-10-31 07:00:00+00:00,"Market Report - Oct. 31, 2011 - CNNMoney - CNN"
2010-04-05 07:00:00+00:00,The Great American Bubble Machine - Rolling Stone
2011-09-26 07:00:00+00:00,"Deflation fears are back - Sep. 26, 2011 - CNN"
2010-10-20 07:00:00+00:00,"As U.S. Dollar’s Value Falls, Currency Conflicts Rise - The New York Times"
2011-06-06 07:00:00+00:00,Another blow for embattled iPad maker Foxconn - BBC.com
2011-08-29 07:00:00+00:00,Europe's Big Mistake - The New Yorker
2011-01-16 08:00:00+00:00,Euros or deutschmarks? - DW (English)
2011-02-04 08:00:00+00:00,Investors fear anti-market regime in Egypt - Reuters
2011-02-27 08:00:00+00:00,China’s export-led growth model - East Asia Forum
2010-12-15 08:00:00+00:00,Kenya election violence: ICC names suspects - BBC.com
2011-05-26 07:00:00+00:00,"Gearing towards a strong base - BusinessToday - Issue Date: May 29, 2011 - Business Today"
2011-09-07 07:00:00+00:00,"Market Report - Sep. 7, 2011 - CNNMoney - CNN"
2010-08-05 07:00:00+00:00,"Natural Gas Weekly Update, Printer-Friendly Version - EIA"
2011-03-14 07:00:00+00:00,Earthquakes: the 10 biggest in history - Australian Geographic
2010-09-30 07:00:00+00:00,'Slow Ride' Rock Hit Describes Economic Recovery - UCF
2011-08-07 07:00:00+00:00,Stocks Slump in First Trading Day Since Downgrade - The New York Times
2011-03-30 07:00:00+00:00,Effects of crude oil supply disruptions: how long can they last? - U.S. Energy Information Administration - EIA
2011-11-15 08:00:00+00:00,Spanish borrowing costs soar ahead of election - CTV News
2010-04-21 07:00:00+00:00,Goldman Sachs charged over CDO transaction - Cayman Compass
2011-10-03 07:00:00+00:00,"Why Germany Can't Save Europe, Much Less The World - TIME"
2011-03-22 07:00:00+00:00,Disruption in Japan Slows Rise in Oil Price - The New York Times
2011-01-01 08:00:00+00:00,"Gold Weekly Fundamental Analysis April 2-6, 2012, Forecast | FXEmpire - FX Empire"
2010-12-09 08:00:00+00:00,Don't Confuse Accumulate with Speculate | Accumulator Contracts Multiply Risks and Rewards - Farm Progress
2011-07-01 07:00:00+00:00,European growth and renewal: The path from crisis to recovery - McKinsey
2011-07-26 07:00:00+00:00,"Wealth Gaps Rise to Record Highs Between Whites, Blacks, Hispanics - Pew Research Center"
2011-08-12 07:00:00+00:00,"Market Report - Aug. 12, 2011 - CNNMoney - CNN"
2011-11-09 08:00:00+00:00,European debt crisis spiralling out of control - The Guardian
2010-09-23 07:00:00+00:00,"Blockbuster's Rise and Fall: The Long, Rewinding Road - TheStreet"
2011-10-21 07:00:00+00:00,"Gold rises, euro worries restrict gains - IOL"
2010-11-01 07:00:00+00:00,The Greek Crisis: Argentina Revisited? - San Francisco Fed - Federal Reserve Bank of San Francisco
2010-04-24 07:00:00+00:00,G20 hails global economic recovery - Al Jazeera English
2010-11-29 08:00:00+00:00,India: Land of Hope and Growth - Financial Sense Online
2010-02-02 08:00:00+00:00,Best case/worst case scenarios in the debt ceiling debate - University of Illinois Urbana-Champaign
2010-12-05 08:00:00+00:00,"Revenue sources for banks drying up, analysts say | Arkansas Democrat Gazette - Arkansas Online"
2010-06-25 07:00:00+00:00,"In 2009, U.S. Led the World in Increases of Oil and Natural Gas Production; China Recorded the Greatest Increase in ... - The Institute for Energy Research"
2011-05-16 07:00:00+00:00,"U.S. has hit debt limit; ""extraordinary measures"" underway - CBS News"
2010-01-24 08:00:00+00:00,China’s response to the global financial crisis - East Asia Forum
2010-04-23 07:00:00+00:00,"Greece, Out of Ideas, Requests Global Aid - The New York Times"
2011-11-23 08:00:00+00:00,Why does market volatility matter? | Yale Insights - Yale Insights
2011-03-31 07:00:00+00:00,Gallup Finds U.S. Unemployment Rate at 10.0% in March - news.gallup.com
2011-04-30 07:00:00+00:00,April 2011 - Calculated Risk
2011-01-28 08:00:00+00:00,U.S. Economy Grew at 3.2% Rate in Late 2010 - The New York Times
2010-03-18 07:00:00+00:00,Japan's Past and the U.S. Future - Carnegie Endowment for International Peace
2010-06-08 07:00:00+00:00,CME Group and Dow Jones Indexes Announce Launch of FX Dollar Index and Futures - PR Newswire
2011-04-28 07:00:00+00:00,Russia's Currency Policy Struggles - Carnegie Russia Eurasia Center - Carnegie Endowment for International Peace
2010-03-04 08:00:00+00:00,Archived - Budget 2010 - Budget Plan: Chapter 2 - Recent Economic Developments and Prospects - budget.canada.ca
2010-10-28 07:00:00+00:00,Nintendo sinks into the red for first half - Phys.org
2010-03-24 07:00:00+00:00,Economy watch: Cheering on the recycling poachers - Salon
2011-04-12 07:00:00+00:00,China Weighs Environmental Concerns Against Economic Growth - PBS NewsHour
2011-09-30 07:00:00+00:00,"Market Report - Sep. 30, 2011 - CNNMoney - CNN"
2011-12-13 08:00:00+00:00,MORGAN STANLEY: This Is What The World's Big Currencies Will Do In 2012 - Business Insider
2010-09-02 07:00:00+00:00,Will Developing Economies Help Sustain the Global Recovery? - Carnegie Endowment for International Peace
2011-03-18 07:00:00+00:00,Japan disaster: G7 intervene to control yen rise - BBC.com
2010-06-01 07:00:00+00:00,BP's shares fall 13% after plan to stop oil leak fails - BBC.com
2010-02-17 08:00:00+00:00,Can the United States Double Exports in Five Years? - Carnegie Endowment for International Peace
2010-02-25 08:00:00+00:00,"For new homes, sales hit new low | Arkansas Democrat Gazette - Arkansas Online"
2011-09-21 07:00:00+00:00,The Fed needs a little help from its friends - CNN
2011-04-06 07:00:00+00:00,"Soaring Food Prices: Causes, Consequences, and Remedies - Carnegie Endowment for International Peace"
2011-11-16 08:00:00+00:00,EU contagion worries shock US stocks - SKNVibes.com
2011-08-03 07:00:00+00:00,US avoids default as Obama signs debt bill into law - BBC.com
2011-10-27 07:00:00+00:00,"GDP report: Growth picks up - Oct. 27, 2011 - CNN"
2011-06-16 07:00:00+00:00,"Market Report - Jun. 16, 2011 - CNNMoney - CNN"
2011-01-27 08:00:00+00:00,The Future of the Global Muslim Population - Pew Research Center
2011-03-23 07:00:00+00:00,7 Ways Of Shorting China’s Real Estate Bubble - Business Insider
2011-07-29 07:00:00+00:00,"Market Report - Jul. 29, 2011 - CNNMoney - CNN"
2011-07-02 07:00:00+00:00,Vikram Pandit's payouts climb towards $200 million - The Economic Times
2011-12-03 08:00:00+00:00,The Four Key Seasonal Trends for 2012 - Forbes
2011-05-17 07:00:00+00:00,Gold rises as US dollar retreats - IOL
2010-02-01 08:00:00+00:00,"In $3.8 Trillion Budget, Obama Pivots to Trim Future Deficits (Published 2010) - The New York Times"
2010-11-15 08:00:00+00:00,Europe Fears Debt Crisis Is Growing - The New York Times
2010-09-01 07:00:00+00:00,World Sugar Price Volatility Intensified by Market and Policy Factors - usda.gov
2011-12-30 08:00:00+00:00,Hungarian central bank measure backed - RTE.ie
2011-10-29 07:00:00+00:00,EU fund says all 3 agencies confirm its AAA rating - SKNVibes.com
2010-02-03 08:00:00+00:00,Quality on the Line: The Fallout from Toyota's Recall - Knowledge@Wharton
2010-01-28 08:00:00+00:00,Natural Gas Weekly Update - EIA
2011-12-19 08:00:00+00:00,"Senate approves tax cut extension: Investors turn to House vote, GDP and housing - CBS News"
2011-03-10 08:00:00+00:00,"How To Trade Moody's Spanish Debt Rating Cut (EPV, STD, TEF, EWP) - ProShares UltraShort FTSE Europe ETF - Benzinga"
2010-03-01 08:00:00+00:00,"Access to Affordable, Nutritious Food Is Limited in “Food Deserts” - usda.gov"
2011-09-09 07:00:00+00:00,ECB chief economist Juergen Stark resigns - CBC News
2010-09-13 07:00:00+00:00,It's Not Really A Lost Decade - Forbes
2011-09-03 07:00:00+00:00,Strategists See Stocks Rising - Barron's
2011-01-25 08:00:00+00:00,"Financial Crisis Was Avoidable, Inquiry Concludes - The New York Times"
2010-03-10 08:00:00+00:00,In Pictures: The Richest People In The World - Forbes
2011-09-22 07:00:00+00:00,"Market Report - Sep. 22, 2011 - CNNMoney - CNN"
2010-06-29 07:00:00+00:00,Oil prices fall more than $2 - RTE.ie
2010-03-05 08:00:00+00:00,"Finance & Development, March 2010 - Housing Prices: More Room to Fall? - International Monetary Fund"
2010-01-21 08:00:00+00:00,Welcome message at the Annual General Assembly of the Manufacturers' Association of Israel (MAI) - European Central Bank
2011-04-01 07:00:00+00:00,Stocks Rally on March Job Gains - TheStreet
2010-05-14 07:00:00+00:00,"US Stocks Tumbled Yesterday, Led By The Consumer-Discretionary Sector - Alcoa (NYSE:AA), American Express - Benzinga"
2010-02-27 08:00:00+00:00,"Warren Buffett: ""When It's Raining Gold, Reach For a Bucket"" - CNBC"
2010-02-15 08:00:00+00:00,BBC News - Metal prices rising strongly again - CBBC Newsround
2010-10-17 07:00:00+00:00,The man with the gold ... rules | Commentary - Jamaica Gleaner
2010-05-06 07:00:00+00:00,Sustainability Faceoff: Chevron vs. ExxonMobil - Fast Company
2011-09-23 07:00:00+00:00,"Market Report - Sep. 23, 2011 - CNNMoney - CNN"
2010-06-12 07:00:00+00:00,World Cup unlikely to drive South African rand - MarketWatch
2010-11-18 08:00:00+00:00,Written Testimony of Chief of Homeownership Preservation Office Phyllis Caldwell - Nuveen Virginia Qualit - Benzinga
2010-05-10 07:00:00+00:00,EU and IMF agree 750 billion-euro fund for crisis-hit eurozone members - FRANCE 24 English
2011-12-27 08:00:00+00:00,Outlook 2012: Can U.S. Dollar Bulls Keep Hold Of The Reins? - Forbes
2010-04-07 07:00:00+00:00,ECB: E44.890 Bln Covered Bond Purchases Settled Apr 6 - ForexLive
2010-11-05 07:00:00+00:00,"The Buzz: Should Berkshire sell its Washington Post stake? - Nov. 5, 2010 - CNN"
2011-05-13 07:00:00+00:00,U.S. Inflation Leaps as Food and Gas Prices Rise - The New York Times
2010-09-27 07:00:00+00:00,Forecasting Growth over the Next Year with a Business Cycle Index - Federal Reserve Bank of San Francisco
2011-12-05 08:00:00+00:00,"Market Report - Dec. 5, 2011 - CNNMoney - CNN"
2011-08-25 07:00:00+00:00,"Warren Buffett invests in Bank of America, stock jumps - Aug. 25, 2011 - CNN"
2011-07-15 07:00:00+00:00,Italy parliament adopts austerity package - Al Jazeera English
2011-02-09 08:00:00+00:00,My Biggest Surprise in the US: Sadia's Story - Voice of America - VOA News
2010-04-30 07:00:00+00:00,Jobless claims fall to month low | Arkansas Democrat Gazette - Arkansas Online
2011-06-02 07:00:00+00:00,"Anemic Jobs Growth, Higher Unemployment Bodes Ill for Economy - ABC News"
2011-12-12 08:00:00+00:00,More Charts of the Day: Italy Works Over 20% More Hours Than Germany and France - Credit Writedowns
2010-08-17 07:00:00+00:00,"The age of no more tears investing - Aug. 17, 2010 - CNN"
2010-06-02 07:00:00+00:00,The Euro Crisis: A Threat to the U.S. Economy - Carnegie Endowment for International Peace
2010-05-12 07:00:00+00:00,"FOREX, COMMODITIES, STOCKS OUTLOOK May 12th: Cliff’s 2 Minute Drill 11:30 GMT - Morgan Stanley (NYSE:MS) - Benzinga"
2010-12-11 07:20:22+00:00,"Finance & Development, December 2010 - Emerging Markets Come of Age - International Monetary Fund"
2010-03-16 07:00:00+00:00,Opec members refuse to change 'balanced' oil production target - FRANCE 24 English
2010-02-11 08:00:00+00:00,Greek debt crisis: the view from Germany - The Guardian
2011-12-01 08:00:00+00:00,"China's PMI worse than expected for November - Dec. 1, 2011 - CNN"
2011-06-30 07:00:00+00:00,Germany votes to end nuclear power by 2022 - The Guardian
2011-01-20 08:00:00+00:00,"Earnings Preview: McDonald's - Analyst Blog - Yum Brands (NYSE:YUM), McDonald's (NYSE:MCD) - Benzinga"
2011-05-19 07:00:00+00:00,Japan falls back into recession - Al Jazeera English
2010-09-15 07:00:00+00:00,"CNNMoney.com Market Report - Sep. 15, 2010 - CNN"
2011-09-08 07:00:00+00:00,"TSX falls on soft U.S. data, ECB comments - Reuters"
2011-12-11 08:00:00+00:00,Secretary-General welcomes climate change deal reached at UN conference in Durban - UN News
2010-12-31 08:00:00+00:00,"2010 stock market in review - Dec. 31, 2010 - CNN"
2010-12-16 08:00:00+00:00,Ron Paul Appears Poised to Irk the Fed Chief (Published 2010) - The New York Times
2011-04-05 07:00:00+00:00,"Why Nasdaq is giving Apple less weight, and Microsoft more - GeekWire"
2011-11-29 08:00:00+00:00,Ratings Firms Misread Signs of Greek Woes - The New York Times
2010-10-25 07:00:00+00:00,Hurricane Richard strikes Belize - Al Jazeera English
2010-11-17 08:00:00+00:00,Ireland’s debt woes renew fears of capital flight - 코리아타임스
2010-08-03 07:00:00+00:00,Euro climbs over 1.32 dollars for the first time since May 4th - FRANCE 24 English
2011-03-01 08:00:00+00:00,When Irish Eyes Are Crying - Vanity Fair
2011-07-05 07:00:00+00:00,"Market Report - Jul. 5, 2011 - CNNMoney - CNN"
2011-08-30 07:00:00+00:00,BoA sells 13.1 billion shares of CCB; gets USD11.6 billion - The Asset
2011-09-27 07:00:00+00:00,September 2011 - Center For American Progress
2011-05-31 07:00:00+00:00,U.S. Job Satisfaction Struggles to Recover to 2008 Levels - news.gallup.com
2010-10-05 07:00:00+00:00,Sanofi's Genzyme Bid Turns Hostile - WSJ - The Wall Street Journal
2011-02-03 08:00:00+00:00,Bernanke: Don't Play Politics with Debt Ceiling - The Fiscal Times
2010-07-15 07:00:00+00:00,Leak forces new delay to BP oil cap test - Phys.org
2011-05-02 07:00:00+00:00,"Market Report - May. 2, 2011 - CNNMoney.com - CNN"
2011-04-25 07:00:00+00:00,Operation Twist and the Effect of Large-Scale Asset Purchases - San Francisco Fed - Federal Reserve Bank of San Francisco
2011-09-29 07:00:00+00:00,German Lawmakers Pass Expanded Euro Bailout Fund - WBEZ Chicago
2011-08-11 07:00:00+00:00,"Market Report - Aug. 11, 2011 - CNNMoney - CNN"
2010-03-14 08:00:00+00:00,Opinion | Taking On China and Its Currency - The New York Times
2011-04-19 07:00:00+00:00,"Intel earnings, revenue beat Wall Street expectations - Apr. 19, 2011 - CNN"
2010-10-12 07:00:00+00:00,US consumer confidence rises in Oct from Sept-IBD - Reuters
2010-09-24 07:00:00+00:00,German firms' confidence surges - The Guardian
2011-08-15 07:00:00+00:00,"Soros Fund Cut Stakes In Citi, Wells Fargo, Monsanto - The Wall Street Journal"
2010-01-16 08:00:00+00:00,Why was the 1921 recession so bad? - This is Money
2011-10-01 07:00:00+00:00,Be afraid - The Economist
2010-03-08 08:00:00+00:00,Okun's Law and the Unemployment Surprise of 2009 - San Francisco Fed - Federal Reserve Bank of San Francisco
2010-03-03 08:00:00+00:00,Thermo Fisher Trumped by Merck KGaA's $7.2 Billion Bid to Acquire Millipore - DARKDaily.com - Laboratory News
2011-05-09 07:00:00+00:00,Gold futures hit 2-day high on broadly weaker U.S. dollar - Benzinga
2010-12-29 08:00:00+00:00,A New Plan for Euro Bonds | Brookings - Brookings Institution
2011-03-03 08:00:00+00:00,Jobless claims drop to nearly 3-year low - CBS News
2010-06-16 13:44:44+00:00,"Finance & Development, June 2010 - Credit to the Private Sector Remains Weak - International Monetary Fund"
2011-04-26 07:00:00+00:00,"You can justify expensive shoes, but not as 'an investment' - The Globe and Mail"
2011-07-21 07:00:00+00:00,Weather warning in effect on hottest July day ever - CP24
2010-04-13 07:00:00+00:00,Feb. Trade Deficit Creeps Up to $39.7 Billion - CBS News
2011-04-07 07:00:00+00:00,European Central Bank raises interest rates to 1.25% - The Guardian
2010-09-12 07:00:00+00:00,"Stocks, Commodities, 5 Forex Key Market Drivers September 13th – 17th Abridged - Benzinga"
2011-03-21 07:00:00+00:00,"Oil prices rise on Libya violence - Mar. 21, 2011 - CNN"
2010-10-07 07:00:00+00:00,In Pictures: The Next Decade's Fastest-Growing Cities - Forbes
2010-03-19 07:00:00+00:00,Employment scarce despite other gains - Pueblo Chieftain
2010-06-16 11:45:44+00:00,"Finance & Development, June 2010 - Asia Leading the Way - International Monetary Fund"
2010-01-29 08:00:00+00:00,Economic recovery still lagging - Arkansas Online
